{
  "schemaVersion": 6,
  "id": "11111111-1111-4111-8111-111111111111",
  "createdAt": "2026-05-12T00:00:00.000Z",
  "updatedAt": "2026-05-12T00:00:00.000Z",
  "project": {
    "name": "Owner-Property-Management-AI-SPA",
    "root": "/Users/Project-Manager/internal-resources/projects/owner-property-management-ai-spa",
    "defaultIDE": "Trae"
  },
  "features": [
    {
      "id": "031",
      "name": "房東的客戶 Grid模式",
      "category": "Frontend/UI",
      "status": "in_progress",
      "progress": 45,
      "paths": {
        "spec": "docs/features/031-landlord-customer-grid.md",
        "tdd": "apps/superadmin/unit_test/031/README.md",
        "test": "apps/superadmin/e2e/031/",
        "implementation": "apps/superadmin/app/superadmin/dashboard/customers/grid/"
      },
      "notes": "需要優化圖片讀取速度",
      "createdAt": "2026-05-12T00:00:00.000Z",
      "updatedAt": "2026-05-12T00:00:00.000Z"
    },
    {
      "id": "032",
      "name": "租客合約自動生成",
      "category": "Backend/AI",
      "status": "todo",
      "progress": 0,
      "paths": {
        "spec": "docs/features/032-contract-gen.md",
        "tdd": "apps/superadmin/unit_test/032/README.md"
      }
    },
    {
      "id": "033",
      "name": "報表匯出功能",
      "category": "Backend/Export",
      "status": "on_hold",
      "progress": 20,
      "paths": {
        "spec": "docs/features/033-report-export.md"
      },
      "notes": "等待後端 API 確認欄位格式，PM 尚未回覆"
    },
    {
      "id": "034",
      "name": "通知推播整合",
      "category": "Backend/Notification",
      "status": "in_progress",
      "progress": 70,
      "paths": {
        "spec": "docs/features/034-push-notification.md",
        "implementation": "apps/superadmin/app/api/notifications/"
      }
    },
    {
      "id": "035",
      "name": "房源照片管理",
      "category": "Frontend/Media",
      "status": "done",
      "progress": 100,
      "paths": {
        "spec": "docs/features/035-photo-management.md",
        "implementation": "apps/superadmin/app/superadmin/properties/photos/"
      }
    },
    {
      "id": "036",
      "name": "帳單自動生成",
      "category": "Backend/Finance",
      "status": "todo",
      "progress": 0,
      "paths": {
        "spec": "docs/features/036-auto-billing.md"
      }
    }
  ],
  "engineerRoles": [
    {
      "id": "role-frontend",
      "name": "Frontend Engineer",
      "slug": "frontend",
      "skills": ["React", "TypeScript", "Tailwind CSS", "Next.js"],
      "commands": ["npm run dev", "npm run typecheck", "npm run build"],
      "systemPrompt": "You are a senior frontend engineer specializing in React and TypeScript. Focus on component architecture, type safety, accessibility, and pixel-perfect UI implementation. Follow the project's existing patterns and conventions. Prefer composition over inheritance, keep components small and focused.",
      "referenceFiles": ["CLAUDE.md"],
      "notes": ""
    },
    {
      "id": "role-backend",
      "name": "Backend Engineer",
      "slug": "backend",
      "skills": ["Node.js", "TypeScript", "REST API", "PostgreSQL"],
      "commands": ["npm run dev", "npm run test"],
      "systemPrompt": "You are a senior backend engineer. Focus on API design, data modeling, security, and performance. Write well-tested, maintainable server-side code. Validate inputs at boundaries, handle errors explicitly, and never expose internal errors to clients.",
      "referenceFiles": ["CLAUDE.md"],
      "notes": ""
    },
    {
      "id": "role-fullstack",
      "name": "Full-stack Engineer",
      "slug": "fullstack",
      "skills": ["React", "Node.js", "TypeScript", "PostgreSQL", "REST API"],
      "commands": ["npm run dev", "npm run typecheck"],
      "systemPrompt": "You are a senior full-stack engineer comfortable with both frontend and backend. Balance UI quality with solid API design and data integrity. Consider the full request lifecycle from user interaction to database and back.",
      "referenceFiles": ["CLAUDE.md"],
      "notes": ""
    },
    {
      "id": "role-qa",
      "name": "QA Engineer",
      "slug": "qa",
      "skills": ["Testing", "Playwright", "Vitest", "Test Planning", "E2E"],
      "commands": ["npm run test", "npx playwright test"],
      "systemPrompt": "You are a senior QA engineer. Focus on writing comprehensive tests that cover happy paths, edge cases, and error scenarios. Prefer integration tests over pure mocks. Think about what could go wrong and write tests that would catch regressions.",
      "referenceFiles": ["CLAUDE.md"],
      "notes": ""
    },
    {
      "id": "role-devops",
      "name": "DevOps Engineer",
      "slug": "devops",
      "skills": ["Docker", "CI/CD", "GitHub Actions", "Infrastructure", "Shell"],
      "commands": ["docker build .", "docker compose up", "gh workflow run"],
      "systemPrompt": "You are a senior DevOps engineer. Focus on build pipelines, containerization, deployment automation, and system reliability. Prefer declarative configuration. Make deployments repeatable and rollbacks easy.",
      "referenceFiles": ["CLAUDE.md"],
      "notes": ""
    },
    {
      "id": "role-devex",
      "name": "開發者體驗專員",
      "slug": "devex",
      "skills": [
        "Developer Experience",
        "CLI Design",
        "Documentation",
        "Onboarding",
        "Error Messages",
        "Tooling"
      ],
      "commands": ["npm run docs:check", "npm run typecheck"],
      "systemPrompt": "You are a senior Developer Experience (DX) specialist. Focus on reducing friction across the developer workflow — clear CLI/UI affordances, actionable error messages, smooth onboarding, well-structured docs, and ergonomic defaults. Audit features through the lens of a first-time user: identify rough edges, missing guardrails, and confusing terminology. Prefer small, polish-oriented improvements that compound over time.",
      "referenceFiles": ["CLAUDE.md"],
      "notes": ""
    }
  ],
  "adapters": {
    "ides": [
      {
        "id": "Trae",
        "name": "Trae",
        "type": "ide",
        "command": "trae"
      },
      {
        "id": "Cursor",
        "name": "Cursor",
        "type": "ide",
        "command": "cursor"
      },
      {
        "id": "VSCode",
        "name": "Visual Studio Code",
        "type": "ide",
        "command": "code"
      }
    ],
    "agents": [
      {
        "id": "codex",
        "name": "Codex CLI",
        "type": "agent",
        "command": "codex",
        "argsTemplate": ["exec", "--cwd", "{root}", "{prompt}"]
      },
      {
        "id": "claude-code",
        "name": "Claude Code",
        "type": "agent",
        "command": "claude",
        "argsTemplate": ["--cwd", "{root}", "{prompt}"]
      }
    ]
  }
}
